<?xml version="1.0" encoding="UTF-8"?>
<hospital xmlns:xsi="http://www.w3.org/2001/XMLSchema-instance" xsi:noNamespaceSchemaLocation="hospital.xsd">
    <departments>
        <department>
            <id>1</id>
            <name>Cardiology</name>
        </department>
        <department>
            <id>2</id>
            <name>Pediatrics</name>
        </department>
    </departments>
    <nurses>
        <nurse>
            <id>1</id>
            <firstName>Alice</firstName>
            <lastName>Smith</lastName>
            <shift>Day</shift>
            <departmentId>1</departmentId>
        </nurse>
        <nurse>
            <id>2</id>
            <firstName>Bob</firstName>
            <lastName>Johnson</lastName>
            <shift>Night</shift>
            <departmentId>2</departmentId>
        </nurse>
    </nurses>
    <doctors>
        <doctor>
            <id>1</id>
            <firstName>Dr. Emily</firstName>
            <lastName>Brown</lastName>
            <specialty>Cardiology</specialty>
            <departmentId>1</departmentId>
        </doctor>
        <doctor>
            <id>2</id>
            <firstName>Dr. Mark</firstName>
            <lastName>Wilson</lastName>
            <specialty>Pediatrics</specialty>
            <departmentId>2</departmentId>
        </doctor>
    </doctors>
    <patients>
        <patient>
            <id>1</id>
            <firstName>John</firstName>
            <lastName>Doe</lastName>
            <birthDate>1990-01-01</birthDate>
            <address>123 Main St</address>
        </patient>
        <patient>
            <id>2</id>
            <firstName>Jane</firstName>
            <lastName>Doe</lastName>
            <birthDate>1992-02-02</birthDate>
            <address>456 Second St</address>
        </patient>
    </patients>
    <rooms>
        <room>
            <roomId>101</roomId>
            <roomNumber>101</roomNumber>
            <roomType>Private</roomType>
            <availability>true</availability>
        </room>
        <room>
            <roomId>102</roomId>
            <roomNumber>102</roomNumber>
            <roomType>Shared</roomType>
            <availability>false</availability>
        </room>
    </rooms>
    <appointments>
        <appointment>
            <appointmentId>1</appointmentId>
            <appointmentDate>2024-10-15</appointmentDate>
            <appointmentTime>10:00</appointmentTime>
            <doctorId>1</doctorId>
            <patientId>1</patientId>
            <roomId>101</roomId>
        </appointment>
        <appointment>
            <appointmentId>2</appointmentId>
            <appointmentDate>2024-10-16</appointmentDate>
            <appointmentTime>11:00</appointmentTime>
            <doctorId>2</doctorId>
            <patientId>2</patientId>
            <roomId>102</roomId>
        </appointment>
    </appointments>
</hospital>